{
  "schema": "navdata-canonical",
  "schemaVersion": "1.0.0",
  "metadata": {
    "datasetId": null,
    "source": "FAA-CIFP",
    "inputFile": null,
    "effectiveFrom": null,
    "effectiveTo": null,
    "generatedAt": null
  },
  "entities": {
    "airports": [
      {
        "id": "airport:US:KPRC",
        "type": "airport",
        "ident": "KPRC",
        "icao": "US",
        "name": "Procedure Intl",
        "iata": null,
        "coord": [
          -73,
          40.5
        ],
        "elevationM": 6.096,
        "sourceRefs": [
          {
            "recordType": "PA",
            "lineNumber": 2,
            "rawLine": "S   P KPRCUSA                   N40300000W073000000     00020                                Procedure Intl                         ",
            "entityType": "airports",
            "entityId": "airport:US:KPRC"
          }
        ]
      }
    ],
    "heliports": [],
    "runways": [],
    "waypoints": [
      {
        "id": "waypoint:EA:US:K2:PRC1",
        "type": "waypoint",
        "ident": "PRC1",
        "region": "K2",
        "icao": "US",
        "usage": "E",
        "waypointType": "WPT",
        "name": "PROC FIX 1",
        "coord": [
          -72.83333333333333,
          40.583333333333336
        ],
        "sourceRefs": [
          {
            "recordType": "EA",
            "lineNumber": 3,
            "rawLine": "S   EAK2  US PRC1         WPTE  N40350000W072500000                                               PROC FIX 1                        ",
            "entityType": "waypoints",
            "entityId": "waypoint:EA:US:K2:PRC1"
          }
        ]
      },
      {
        "id": "waypoint:EA:US:K2:PRC2",
        "type": "waypoint",
        "ident": "PRC2",
        "region": "K2",
        "icao": "US",
        "usage": "E",
        "waypointType": "WPT",
        "name": "PROC FIX 2",
        "coord": [
          -72,
          40.666666666666664
        ],
        "sourceRefs": [
          {
            "recordType": "EA",
            "lineNumber": 4,
            "rawLine": "S   EAK2  US PRC2         WPTE  N40400000W072000000                                               PROC FIX 2                        ",
            "entityType": "waypoints",
            "entityId": "waypoint:EA:US:K2:PRC2"
          }
        ]
      }
    ],
    "navaids": [],
    "airways": [],
    "airspaces": [],
    "procedures": [
      {
        "id": "procedure:PD:US:KPRC:PRC1:1:RW04",
        "type": "procedure",
        "procedureType": "PD",
        "airportId": "airport:US:KPRC",
        "runwayId": null,
        "procedureCode": "PRC1",
        "transitionId": "RW04",
        "refs": {
          "fixIds": [
            "waypoint:EA:US:K2:PRC1",
            "waypoint:EA:US:K2:PRC2"
          ],
          "fixRawIds": [
            "PRC1",
            "PRC2"
          ]
        },
        "coordinates": [
          [
            -72.83333333333333,
            40.583333333333336
          ],
          [
            -72,
            40.666666666666664
          ]
        ],
        "bbox": [
          -72.83333333333333,
          40.583333333333336,
          -72,
          40.666666666666664
        ],
        "legs": [
          {
            "seq": 1,
            "fixId": "waypoint:EA:US:K2:PRC1",
            "fixRawId": "PRC1",
            "pathTerm": "TF",
            "turnDir": "R",
            "alt1": "05000",
            "alt2": "09000",
            "speed": "250"
          },
          {
            "seq": 2,
            "fixId": "waypoint:EA:US:K2:PRC2",
            "fixRawId": "PRC2",
            "pathTerm": "TF",
            "turnDir": "R",
            "alt1": "05000",
            "alt2": "09000",
            "speed": "250"
          }
        ],
        "sourceRefs": [
          {
            "recordType": "PD",
            "lineNumber": 5,
            "rawLine": "S   P KPRCUSDPRC1  1RW04  001PRC1 USEA1    R   TF                                   0500009000     250                              ",
            "entityType": "procedures",
            "entityId": "procedure:PD:US:KPRC:PRC1:1:RW04"
          },
          {
            "recordType": "PD",
            "lineNumber": 6,
            "rawLine": "S   P KPRCUSDPRC1  1RW04  002PRC2 USEA1    R   TF                                   0500009000     250                              ",
            "entityType": "procedures",
            "entityId": "procedure:PD:US:KPRC:PRC1:1:RW04"
          }
        ]
      }
    ],
    "holds": []
  }
}
